{
  "schema_version": 1,
  "project": "SongChart-Next",
  "authority": "governance/RESEARCH_REGISTRY.json",
  "rule": "Register research only with a retrievable source; registration/acceptance does not approve a technology or roadmap change. No historic chat or old SongChart artifacts become implementation authority.",
  "research": [
    {
      "id": "RES-0001",
      "title": "MusicBrainz provider activation constraints",
      "source": "docs/research/RES-0001-musicbrainz-provider-constraints.md",
      "status": "accepted",
      "capability_ids": [
        "provider-policy",
        "provider-adapters"
      ],
      "decision_ref": "docs/providers/MUSICBRAINZ.md",
      "superseded_by": null
    },
    {
      "id": "RES-0002",
      "title": "CocoIndex derived repository context and documentation-impact evaluation",
      "source": "docs/research/RES-0002-cocoindex-repository-context.md",
      "status": "evaluated",
      "capability_ids": [
        "project-os"
      ],
      "decision_ref": null,
      "superseded_by": null
    }
  ]
}
